question,answer
日本語の系統上の位置づけと、大和言葉に見られる音韻的な特徴について教えてください。,日本語の系統は、琉球語と共に「日琉語族」を形成するとされますが、他の語族との同系関係は立証されておらず不明です。古い大和言葉の特徴としては、語頭に「ら行」音や濁音が立たないこと、同一語根内に母音が連続しないことなどが挙げられ、これらは日本語が「アルタイ型」の言語である根拠の一つとされています。
古代エジプトの農業と社会構造は、ナイル川とどのように関わっていたのでしょうか？,古代エジプトは、毎年決まった時期に起こるナイル川の穏やかな氾濫を利用した「ベイスン灌漑方式」により、肥沃な土壌を確保して農業を営んでいました。社会はファラオを頂点とする神権政治が行われ、人口の約99%を占める平民は、生産物の租税と無償労働を課せられる「セメデト（不自由な小作）」として社会を支えていました。
コンピュータ科学における「人工知能（AI）」の変遷と、現在のブームについて説明してください。,AIは、計算機による知的な情報処理システムの設計や実現を研究する分野です。第1次の「探索と推論」、第2次の「知識表現」というブームと冬の時代を経て、2012年以降はディープラーニングの有用性が認知された「第3次人工知能ブーム」が到来しました。現在はChatGPTなどの生成AIの登場により、実務応用が爆発的に加速しています。
地理学の学問的変遷と、オーストリア・インドネシアの国家背景について教えてください。,地理学は古代ギリシアを起源とし、1950年代の計量革命を経て科学化が進みました。オーストリアはハプスブルク帝国の歴史を持ち1955年に永世中立化した連邦共和国です。インドネシアは1万7000以上の島を抱える世界最大の群島国家であり、多様な民族を統合する「パンチャシラ」というイデオロギーを国是としています。
日本における著作権の保護期間と、GFDLライセンスが持つコピーレフトの法的枠組みについて教えてください。,日本の著作権保護期間は、2018年の改正により原則「著作者の死後70年」となりました。GFDLは、著作物の自由な利用を保証するライセンスで、改変版（二次的著作物）にも同様のライセンスを課す「コピーレフト」を骨子としています。利用に際しては、全ての著作権表示を残し、主要著作者を5人以上列記する等の条件があります。
インドネシアの地理的特徴と、それに伴う自然災害のリスクについて詳しく教えてください。,"インドネシアは13,466もの島々からなる世界最大の群島国家です。4つのプレートがせめぎ合う環太平洋火山帯に位置し、129の活火山を抱えています。過去300年間の噴火による死者数は世界最多の15万人にのぼり、2004年のスマトラ島沖地震のような甚大な被害をもたらす地震も頻発する、自然災害のリスクが非常に高い地域です。"
日本とインドネシアの経済関係において、主要な産業や投資環境の課題にはどのようなものがありますか？,1800社超の日本企業が進出しており、特にニッケル生産の80%が日本へ輸出されています。また、パーム油（世界首位）やLNGの供給地としても重要です。課題としては、道路や通信等のハードインフラの整備不足に加え、裁判所や行政の判断の不透明さといったソフト面の投資環境がビジネスの阻害要因として指摘されています。
インドネシアが進めている首都移転計画の概要と、その背景にある行政上の特徴を教えてください。,2019年にジャカルタからボルネオ島の東カリマンタン州（新首都名：ヌサンタラ）への移転が閣議決定されました。背景にはジャワ島への極端な人口集中の解消があります。スハルト政権崩壊後は世界有数の地方分権化が進みましたが、逆に中央政府の統制力が弱まり、地方政府による環境破壊を止められない等の弊害も生じています。
インドネシアの人口動態と、宗教的多様性における基本理念について教えてください。,人口は約2.7億人で世界第4位、1.7億人以上のムスリムを抱える世界最大のイスラム人口国です。国家理念「パンチャシラ」では唯一神への信仰を第一原則としていますが、国教は定めず信教の自由を保障する世俗主義を標榜しています。ただし無神論は違法であり、公言すると逮捕される可能性がある点に注意が必要です。
インドネシアで人権問題となっている精神障害者の拘束慣習「パスン」について、その実態を教えてください。,「パスン」は、精神障害者の手足を木製のフレーム等で拘束する因習です。1977年に違法化されましたが、精神医療体制の不備や貧困により、現在も数万人が被害に遭っていると推定されます。政府は「パスンのないインドネシア」を掲げて解放と治療支援を進めていますが、予算不足や家族による隠匿が解決を難しくしています。
