question,answer
欧米の日常的な手書きにおいて、アンパサンドはどのような形で簡略化して書かれることがありますか？,小文字のエプシロン（ε）を大きくしたものや、数字の「3」を鏡文字にして縦線を加えた形がよく使われます。また、エプシロンの上下に縦線や点を付けた形や、プラス記号に輪を重ねた、無声歯茎側面摩擦音の発音記号（ɬ）に似た形が用いられることもあります。
くだけた表現としてプラス記号（+）がアンパサンドの代わりに使用される背景を教えてください。,プラス記号が代用されるのは、この記号自体がアンパサンドと同じくラテン語で「と」を意味する「et」の合字（リガチャー）に由来しているという背景があるためです。そのため、日常的なメモなどで簡便な代替記号として広く受け入れられています。
ティロの速記記号に由来する「⁊ (Tironian sign et)」は、どのような文字体系で使用されていますか？,ティロの速記において「et」を表すために作られたこの記号（U+204A）は、ドイツの伝統的な書体であるフラクトゥールで使用されてきた歴史があります。また、現在でもアイルランドなどで用いられるゲール文字において、継続的に使用されています。
ギリシア文字において、英語のアンパサンドのように「……と」を意味する合字について教えてください。,ギリシア文字では、接続詞の「……と」を意味する「kai」という言葉を表すための専用の合字（U+03D7 Greek kai symbol）が使われることがあります。これは特定の単語を一つの記号にまとめたもので、文書内でアンパサンドと同様の役割を果たします。
C言語における論理AND（&&）とビットAND（&）の動作の違いについて教えてください。,C言語において、2個重ねた「&&」は論理ANDを表し、両方の値が真であれば真を返します。一方、1個の「&」はビットANDを表します。例えば「0x12345678 & 0x0f0f0f0f」という演算を行った場合、ビット単位で計算され、結果は「0x02040608」となります。
PHPにおいて、アンパサンド（&）記号はどのような目的で使用されますか？,PHPでは、変数宣言記号（$）の直前にアンパサンド（&）を記述することで、参照渡しを行うために使用されます。これにより、変数の値をコピーするのではなく、メモリ上の同じ実体を参照させることが可能になります。
BASIC系列の言語における、文字列連結演算子としてのアンパサンドの役割を説明してください。,"BASIC系列の言語において、アンパサンド（&）は文字列を結合するための連結演算子として使用されます。具体的な例として、「""foo"" & ""bar""」という演算を行うと、結合された「""foobar""」という文字列が返されます。"
Microsoft系の言語で、整数を十六進数で表記する際のルールについて教えてください。,主にマイクロソフト系の言語では、整数の十六進表記を行う際に「&h」というプリフィックス（接頭辞）を用います。例えば、十進数で15にあたる数値は、このルールに従って「&h0F」のように表現されます。
SGML、XML、HTMLにおいて、SGML実体を参照するために使用される記号は何ですか？,SGML、XML、HTMLでは、SGML実体を参照するためにアンパサンドを使用します。
言語の定義における「狭義」と「広義」にはどのような違いがありますか？,狭義の言語は「声による記号の体系」を指します。一方、広義の言語には言葉による表現（verbal）だけでなく、アイコン、図形、ボディーランゲージなどの言葉として表されない表現（non-verbal）も含まれます。日常的には、狭義の言語に身振りや手振り、図示などを加えて情報を伝達することもあります。
「広辞苑」や「大辞泉」では、言語の役割や定義をどのように説明していますか？,広辞苑では、人間が音声や文字を用いて思想・感情などを伝達するための記号体系、およびその行為と定義されています。大辞泉では、意志や思想を表現・伝達し、他者のそれを理解するための約束・規則、あるいは記号の体系であると説明されており、いずれも音声や文字を通じたコミュニケーションの手段として位置づけています。
『日本大百科全書』において、言語はどのような多義的な概念として解説されていますか？,言語は多義的であり、大脳に蓄えられた「語彙と文法規則の体系」やその体系を用いる「能力」を指すとされています。また、全人類に共通する抽象的な「言語能力」を指すこともあれば、特定の社会で使用される「個々の個別言語」を指すこともあるなど、脳内システムから具体的な言語体系まで幅広く捉えられています。
「個別言語」という概念と、ソシュールが用いた用語との関係について教えてください。,個別言語とは、英語、フランス語、日本語のように、特定の集団が伝達手段として用いる音や文字の体系を指します。また、この「言語」という言葉は、スイスの言語学者ソシュールが提唱した概念である「langue（ラング）」の日本語における訳語としても使われています。
